[
  {
    "id": "reporters-collective",
    "name": "The Reporters' Collective",
    "url": "https://www.reporters-collective.in/",
    "kind": "outlet",
    "categories": [
      "investigative",
      "accountability"
    ],
    "focus": [
      "public policy",
      "governance",
      "political economy",
      "documents-based investigations"
    ],
    "languages": [
      "English",
      "collaborations"
    ],
    "region": "India",
    "free_to_read": "yes",
    "paywall": "none",
    "ownership_funding": "IPSMF grant support disclosed; reader donations encouraged",
    "independence_signal": "foundation-supported + reader-supported",
    "transparency_rating": "high",
    "ifcn_verified": "not_applicable",
    "rss": "unknown",
    "newsletter": "yes",
    "correction_policy": "unknown",
    "methodology_page": "not_applicable",
    "notable_review_note": "About page discloses IPSMF support and public-interest collaborative model.",
    "caveats": [],
    "verification_status": "baseline_verified",
    "last_reviewed": "2026-05-26",
    "evidence": [
      "https://www.reporters-collective.in/about"
    ]
  },
  {
    "id": "article-14",
    "name": "Article 14",
    "url": "https://article-14.com/",
    "kind": "outlet",
    "categories": [
      "legal",
      "constitutional",
      "rights"
    ],
    "focus": [
      "courts",
      "civil liberties",
      "law",
      "governance"
    ],
    "languages": [
      "English"
    ],
    "region": "India",
    "free_to_read": "yes",
    "paywall": "none",
    "ownership_funding": "needs_review",
    "independence_signal": "public-interest legal journalism",
    "transparency_rating": "medium",
    "ifcn_verified": "not_applicable",
    "rss": "unknown",
    "newsletter": "unknown",
    "correction_policy": "unknown",
    "methodology_page": "not_applicable",
    "notable_review_note": "No notable controversy/correction added yet. Requires evidence before adding claims.",
    "caveats": [],
    "verification_status": "needs_community_review",
    "last_reviewed": "2026-05-26",
    "evidence": [
      "https://article-14.com/"
    ]
  },
  {
    "id": "scroll",
    "name": "Scroll.in",
    "url": "https://scroll.in/",
    "kind": "outlet",
    "categories": [
      "digital-news",
      "analysis",
      "culture"
    ],
    "focus": [
      "politics",
      "society",
      "culture",
      "ground reports"
    ],
    "languages": [
      "English"
    ],
    "region": "India",
    "free_to_read": "yes",
    "paywall": "none",
    "ownership_funding": "SCSN Pvt Ltd / Scroll Media; details need current review",
    "independence_signal": "independent digital newsroom",
    "transparency_rating": "medium",
    "ifcn_verified": "not_applicable",
    "rss": "yes",
    "newsletter": "yes",
    "correction_policy": "unknown",
    "methodology_page": "not_applicable",
    "notable_review_note": "No notable controversy/correction added yet. Requires evidence before adding claims.",
    "caveats": [],
    "verification_status": "needs_ownership_refresh",
    "last_reviewed": "2026-05-26",
    "evidence": [
      "https://scroll.in/",
      "https://en.wikipedia.org/wiki/Scroll.in"
    ]
  },
  {
    "id": "the-wire",
    "name": "The Wire",
    "url": "https://thewire.in/",
    "kind": "outlet",
    "categories": [
      "digital-news",
      "investigative",
      "opinion"
    ],
    "focus": [
      "politics",
      "policy",
      "rights",
      "media",
      "science"
    ],
    "languages": [
      "English",
      "Hindi",
      "Urdu"
    ],
    "region": "India",
    "free_to_read": "yes",
    "paywall": "none",
    "ownership_funding": "Foundation / reader-supported model; refresh required",
    "independence_signal": "reader-supported public-interest outlet",
    "transparency_rating": "medium",
    "ifcn_verified": "not_applicable",
    "rss": "unknown",
    "newsletter": "yes",
    "correction_policy": "unknown",
    "methodology_page": "not_applicable",
    "notable_review_note": "No notable controversy/correction added yet. Requires evidence before adding claims.",
    "caveats": [
      "Strong opinion section; readers should separate reportage, analysis, and opinion."
    ],
    "verification_status": "needs_ownership_refresh",
    "last_reviewed": "2026-05-26",
    "evidence": [
      "https://thewire.in/about-us"
    ]
  },
  {
    "id": "newslaundry",
    "name": "Newslaundry",
    "url": "https://www.newslaundry.com/",
    "kind": "outlet",
    "categories": [
      "media-criticism",
      "digital-news",
      "podcast"
    ],
    "focus": [
      "media accountability",
      "politics",
      "TV coverage",
      "media business"
    ],
    "languages": [
      "English",
      "Hindi"
    ],
    "region": "India",
    "free_to_read": "partial",
    "paywall": "mixed",
    "ownership_funding": "subscription-driven; current ownership refresh required",
    "independence_signal": "subscriber-supported",
    "transparency_rating": "medium",
    "ifcn_verified": "not_applicable",
    "rss": "unknown",
    "newsletter": "yes",
    "correction_policy": "unknown",
    "methodology_page": "not_applicable",
    "notable_review_note": "No notable controversy/correction added yet. Requires evidence before adding claims.",
    "caveats": [
      "Many investigations and shows are paywalled."
    ],
    "verification_status": "baseline_verified",
    "last_reviewed": "2026-05-26",
    "evidence": [
      "https://www.newslaundry.com/"
    ]
  },
  {
    "id": "the-news-minute",
    "name": "The News Minute",
    "url": "https://www.thenewsminute.com/",
    "kind": "outlet",
    "categories": [
      "regional",
      "digital-news"
    ],
    "focus": [
      "South India",
      "gender",
      "politics",
      "society"
    ],
    "languages": [
      "English"
    ],
    "region": "India",
    "free_to_read": "mostly",
    "paywall": "mixed",
    "ownership_funding": "digital media company; current ownership refresh required",
    "independence_signal": "regional digital newsroom",
    "transparency_rating": "medium",
    "ifcn_verified": "not_applicable",
    "rss": "unknown",
    "newsletter": "yes",
    "correction_policy": "unknown",
    "methodology_page": "not_applicable",
    "notable_review_note": "No notable controversy/correction added yet. Requires evidence before adding claims.",
    "caveats": [],
    "verification_status": "baseline_verified",
    "last_reviewed": "2026-05-26",
    "evidence": [
      "https://www.thenewsminute.com/",
      "https://en.wikipedia.org/wiki/The_News_Minute"
    ]
  },
  {
    "id": "the-quint",
    "name": "The Quint",
    "url": "https://www.thequint.com/",
    "kind": "outlet",
    "categories": [
      "digital-news",
      "fact-checking",
      "explainers"
    ],
    "focus": [
      "explainers",
      "politics",
      "gender",
      "youth issues",
      "viral claims"
    ],
    "languages": [
      "English",
      "Hindi"
    ],
    "region": "India",
    "free_to_read": "mostly",
    "paywall": "mixed",
    "ownership_funding": "Quint Digital Ltd / corporate; current refresh required",
    "independence_signal": "digital-first newsroom",
    "transparency_rating": "medium",
    "ifcn_verified": "yes_for_fact_check_unit_needs_refresh",
    "rss": "unknown",
    "newsletter": "yes",
    "correction_policy": "unknown",
    "methodology_page": "not_applicable",
    "notable_review_note": "No notable controversy/correction added yet. Requires evidence before adding claims.",
    "caveats": [
      "Verify breaking-news claims with additional sources."
    ],
    "verification_status": "baseline_verified",
    "last_reviewed": "2026-05-26",
    "evidence": [
      "https://www.thequint.com/"
    ]
  },
  {
    "id": "alt-news",
    "name": "Alt News",
    "url": "https://www.altnews.in/",
    "kind": "outlet",
    "categories": [
      "fact-checking",
      "misinformation"
    ],
    "focus": [
      "political misinformation",
      "communal claims",
      "viral images",
      "social media claims"
    ],
    "languages": [
      "English",
      "Hindi"
    ],
    "region": "India",
    "free_to_read": "yes",
    "paywall": "none",
    "ownership_funding": "Pravda Media Foundation; non-profit model",
    "independence_signal": "non-profit fact-checking",
    "transparency_rating": "medium",
    "ifcn_verified": "not_currently_verified_based_on_available_public_summary",
    "rss": "unknown",
    "newsletter": "unknown",
    "correction_policy": "yes",
    "methodology_page": "yes",
    "notable_review_note": "Public summaries state Alt News was an IFCN signatory until April 2020; current IFCN status should be rechecked before marking yes.",
    "caveats": [],
    "verification_status": "baseline_verified",
    "last_reviewed": "2026-05-26",
    "evidence": [
      "https://www.altnews.in/about/",
      "https://en.wikipedia.org/wiki/Alt_News"
    ]
  },
  {
    "id": "boom-live",
    "name": "BOOM Live",
    "url": "https://www.boomlive.in/",
    "kind": "outlet",
    "categories": [
      "fact-checking",
      "misinformation",
      "deepfakes"
    ],
    "focus": [
      "viral claims",
      "scams",
      "AI/deepfakes",
      "social media misinformation"
    ],
    "languages": [
      "English",
      "Hindi",
      "Bengali"
    ],
    "region": "India",
    "free_to_read": "yes",
    "paywall": "none",
    "ownership_funding": "Outcue Media Pvt Ltd; revenue sources and major contributors disclosed",
    "independence_signal": "for-profit fact-checking newsroom with disclosed platform revenues",
    "transparency_rating": "high",
    "ifcn_verified": "yes",
    "rss": "unknown",
    "newsletter": "yes",
    "correction_policy": "yes",
    "methodology_page": "yes",
    "notable_review_note": "About page states IFCN certification, languages, methodology, correction policy, ownership and FY2025-26 major revenue contributors.",
    "caveats": [],